{"delegationDepth":1,"effects":["graph.write"],"expiresAt":"2026-12-01T00:00:00.0000000Z","id":"sha256:bdfc1f76cf2566b9e8b9f3cbfef49597b95b1efa7985c288d5551daf860754e5","issuer":"agent:hermes","nonce":"aria-alpha19-delegated-graph-write","notBefore":"2026-02-01T00:00:00.0000000Z","parent":"sha256:e9e35d6e13e1b10aedabc2938d0f181d6d3c18a558939c0984691947fd3010f6","resource":"graph:production","schema":"aria.capability/0.5","signature":{"algorithm":"none","value":""},"singleUse":false,"subject":"agent:worker"}