{"delegationDepth":0,"effects":["graph.write"],"expiresAt":"2027-01-01T00:00:00.0000000Z","id":"sha256:e9e35d6e13e1b10aedabc2938d0f181d6d3c18a558939c0984691947fd3010f6","issuer":"operator:jackson","nonce":"aria-alpha19-root-graph-write","notBefore":"2026-01-01T00:00:00.0000000Z","parent":null,"resource":"graph:production","schema":"aria.capability/0.5","signature":{"algorithm":"none","value":""},"singleUse":false,"subject":"agent:hermes"}